{"intent_id":"fairway-dynasty.phase1.operations_loop","objective":"Validate a deterministic golf-course operations daily loop for Fairway Dynasty via mandatory central governance routing and trace-linked evidence.","constraints":["Keep scope minimal and implementation-focused.","Preserve deterministic behavior for verdict-critical paths.","Preserve traceability with hash-referenced evidence and prompt/version refs.","Fallback path must remain available for external-model failures.","CI must gate merge on validation and deterministic tests."],"approval_tier":"medium","human_gate_required":true,"target_executor":"codex","evidence_refs":[]}
