{"intent_id":"tdp.phase2.engagement_loop_v1","objective":"Execute local-first UX engagement loop for TheDivineParadox with deterministic telemetry and governance-linked trace artifacts. Implement immediate retention levers (streak, mission, live tension), keep monetization CTA disabled by default, and produce bridge-consumable task packet for executor handoff.","constraints":["Keep scope minimal and implementation-focused.","Preserve deterministic behavior for verdict-critical paths.","Preserve traceability with hash-referenced evidence and prompt/version refs.","Fallback path must remain available for external-model failures.","CI must gate merge on validation and deterministic tests."],"approval_tier":"high","human_gate_required":true,"target_executor":"codex","evidence_refs":[]}
