{"intent_id":"council-under-siege.phase1.turn_consensus.humangate","objective":"Validate one-turn multi-agent consensus loop via mandatory central governance path.","constraints":["Keep scope minimal and implementation-focused.","Preserve deterministic behavior for verdict-critical paths.","Preserve traceability with hash-referenced evidence and prompt/version refs.","Fallback path must remain available for external-model failures.","CI must gate merge on validation and deterministic tests."],"approval_tier":"medium","human_gate_required":true,"target_executor":"codex","evidence_refs":[]}
