{"intent_id":"tdp.ops.min_token_check","objective":"One-shot minimal token validation objective.","constraints":["Keep scope minimal and implementation-focused.","Preserve deterministic behavior for verdict-critical paths.","Preserve traceability with hash-referenced evidence and prompt/version refs.","Fallback path must remain available for external-model failures.","CI must gate merge on validation and deterministic tests."],"approval_tier":"medium","human_gate_required":false,"target_executor":"codex","evidence_refs":[]}
