{"intent_id":"tdp.phase2.quality_engineering_cell","objective":"Create and operate a Testing/Bug/Refactoring quality engineering cell for TheDivineParadox. Enforce deterministic regression gates, remove redundant scripts/folders, and produce bridge-consumable quality tasks with evidence and rollback conditions.","constraints":["Keep scope minimal and implementation-focused.","Preserve deterministic behavior for verdict-critical paths.","Preserve traceability with hash-referenced evidence and prompt/version refs.","Fallback path must remain available for external-model failures.","CI must gate merge on validation and deterministic tests."],"approval_tier":"high","human_gate_required":true,"target_executor":"codex","evidence_refs":[]}
