{"intent_id":"tdp.phase2.ops_hardening","objective":"Phase-2 이후 운영 고도화: Cloud Run staging/prod 배포 검증 + Secret Manager 연동 + 야간 자동 실행 워크플로우","constraints":["Keep scope minimal and implementation-focused.","Preserve deterministic behavior for verdict-critical paths.","Preserve traceability with hash-referenced evidence and prompt/version refs.","Fallback path must remain available for external-model failures.","CI must gate merge on validation and deterministic tests."],"approval_tier":"high","human_gate_required":true,"target_executor":"codex","evidence_refs":[]}
