{"intent_id":"fairway-dynasty.phase1.2d_loop","objective":"Ship Fairway Dynasty 2D production-ready deterministic operations loop with governance-linked evidence, idle cap, and interactive tutorial flow.","constraints":["Keep scope minimal and implementation-focused.","Preserve deterministic behavior for verdict-critical paths.","Preserve traceability with hash-referenced evidence and prompt/version refs.","Fallback path must remain available for external-model failures.","CI must gate merge on validation and deterministic tests."],"approval_tier":"medium","human_gate_required":true,"target_executor":"codex","evidence_refs":[]}
