{"intent_id":"tdp.phase2.market_validation_pipeline_v1","objective":"Implement Market Validation Pipeline v1 for TheDivineParadox: collect key UX events, compute KPI summary aligned to governance SLO contract (D1 return, vote completion, post-vote result open, LLM fallback rate), expose API-level evidence endpoints, and preserve deterministic trace and governance constraints.","constraints":["Keep scope minimal and implementation-focused.","Preserve deterministic behavior for verdict-critical paths.","Preserve traceability with hash-referenced evidence and prompt/version refs.","Fallback path must remain available for external-model failures.","CI must gate merge on validation and deterministic tests."],"approval_tier":"high","human_gate_required":true,"target_executor":"codex","evidence_refs":[]}
